{
  "$schema": "https://json-schema.org/draft/2020-12/schema",
  "title": "Exercise figures",
  "description": "Small stick-figure drawings for exercises, on a 48 × 48 grid with the floor at y = 45 (x grows to the right, y grows downward). Exercises pick one with their `figure` field; several exercises can share a figure. The app draws the gear the exercise uses (barbell, dumbbell, kettlebell, med ball, cable or band) at the `hold` points.",
  "$defs": {
    "point": {
      "type": "array",
      "items": {
        "type": "number",
        "minimum": 0,
        "maximum": 48
      },
      "minItems": 2,
      "maxItems": 2
    },
    "path": {
      "type": "string",
      "pattern": "^[MLHVCZAmlhvcza0-9 .,-]+$",
      "description": "SVG path data using only M, L, H, V, C, A and Z commands."
    }
  },
  "type": "array",
  "items": {
    "type": "object",
    "additionalProperties": false,
    "required": [
      "id",
      "head",
      "lines"
    ],
    "properties": {
      "id": {
        "type": "string",
        "pattern": "^[a-z0-9]+(-[a-z0-9]+)*$",
        "description": "Figure id that exercises refer to."
      },
      "head": {
        "$ref": "#/$defs/point",
        "description": "Centre of the head."
      },
      "lines": {
        "type": "array",
        "minItems": 1,
        "items": {
          "type": "string",
          "pattern": "^\\d+(\\.\\d+)?,\\d+(\\.\\d+)?( \\d+(\\.\\d+)?,\\d+(\\.\\d+)?)+$"
        },
        "description": "Body and limbs, each a polyline of x,y points separated by spaces."
      },
      "hold": {
        "type": "array",
        "items": {
          "$ref": "#/$defs/point"
        },
        "description": "Where the hands hold the weight. Two points for a weight in each hand."
      },
      "anchor": {
        "$ref": "#/$defs/point",
        "description": "Where a cable or band is attached. Defaults to the top right corner."
      },
      "gear": {
        "enum": [
          "bar-back",
          "bar-over",
          "band-between"
        ],
        "description": "How to draw the gear: bar-back (plate seen from the side), bar-over (bar across both hands), band-between (band stretched between the hands)."
      },
      "scene": {
        "type": "array",
        "items": {
          "$ref": "#/$defs/path"
        },
        "description": "Bench, box, rack or other props, drawn in a lighter line."
      },
      "dashed": {
        "type": "array",
        "items": {
          "$ref": "#/$defs/path"
        },
        "description": "Dashed lines, for example the arc of a jump."
      }
    }
  }
}
