[
  {"id": "backsquat", "head": [17, 11], "lines": ["20,16 30,30", "30,30 19,31 21,44", "20,16 15,20 18,15"], "hold": [[20, 15]], "gear": "bar-back"},
  {"id": "frontsquat", "head": [18, 11], "lines": ["21,16 30,30", "30,30 19,31 21,44", "21,16 14,20 15,17"], "hold": [[14, 17]]},
  {"id": "goblet", "head": [18, 11], "lines": ["21,16 30,30", "30,30 19,31 21,44", "21,16 15,23 14,19"], "hold": [[13, 20]]},
  {"id": "legpress", "head": [36, 21], "lines": ["33,25 28,36", "28,36 20,27 12,31", "33,26 31,32 30,36"], "scene": ["M39 17 L31 40 H42 M8 22 L13 40 M13 40 L42 44"]},
  {"id": "hinge", "head": [11, 17], "lines": ["15,20 31,23", "31,23 29,34 30,44", "15,20 16,28 16,36"], "hold": [[16, 37]]},
  {"id": "trapbar", "head": [13, 15], "lines": ["16,19 30,25", "30,25 26,34 28,44", "16,19 20,27 22,34"], "hold": [[22, 35]], "scene": ["M12 35 H34"]},
  {"id": "hipthrust", "head": [8, 25], "lines": ["12,29 27,27", "27,27 35,30 36,44", "12,29 18,31 25,26"], "hold": [[26, 25]], "scene": ["M3 31 h12 v5 h-12 Z", "M5 36 V44 M13 36 V44"]},
  {"id": "backext", "head": [8, 26], "lines": ["12,27 26,30", "26,30 40,39", "12,28 16,32 19,29"], "scene": ["M21 31 h9 v3 h-9 Z", "M26 34 V44 M40 36 L43 44"]},
  {"id": "nordic", "head": [12, 16], "lines": ["15,20 27,32", "27,32 30,44 42,44", "15,20 11,27 9,34"], "scene": ["M42 41 V44"]},
  {"id": "slrdl", "head": [11, 20], "lines": ["15,22 28,23", "28,23 27,33 27,44", "28,23 37,20 45,18", "15,22 15,30 15,36"], "hold": [[15, 37]]},
  {"id": "splitsquat", "head": [24, 7], "lines": ["24,12 24,29", "24,29 31,34 32,44", "24,29 18,38 10,34", "24,15 22,22 22,29"], "hold": [[22, 30]], "scene": ["M2 33 h11 v4 h-11 Z", "M4 37 V44 M11 37 V44"]},
  {"id": "lunge", "head": [24, 7], "lines": ["24,12 24,28", "24,28 32,34 33,44", "24,28 18,40 10,44", "24,15 22,22 22,29"], "hold": [[22, 30]]},
  {"id": "stepup", "head": [22, 6], "lines": ["22,11 22,26", "22,26 30,24 31,31", "22,26 20,35 18,44", "22,14 20,21 20,28"], "hold": [[20, 29]], "scene": ["M26 31 h16 v13 h-16 Z"]},
  {"id": "latlunge", "head": [21, 10], "lines": ["22,15 24,29", "24,29 14,33 10,44", "24,29 33,36 40,44", "22,18 26,22 28,25"], "hold": [[29, 26]]},
  {"id": "skatersq", "head": [19, 10], "lines": ["21,15 28,29", "28,29 19,32 21,44", "28,29 34,37 32,40", "21,15 13,20 8,22"]},
  {"id": "pistol", "head": [19, 12], "lines": ["22,17 30,31", "30,31 20,33 22,44", "30,31 38,33 45,32", "22,17 14,22 9,24"]},
  {"id": "bench", "head": [8, 29], "lines": ["12,31 28,31", "28,31 35,32 37,44", "12,31 13,23 13,16"], "hold": [[13, 15]], "scene": ["M5 33 h28 v4 h-28 Z", "M9 37 V44 M29 37 V44"]},
  {"id": "incline", "head": [10, 20], "lines": ["13,24 26,33", "26,33 34,32 36,44", "13,24 17,17 19,10"], "hold": [[19, 9]], "scene": ["M6 18 L24 38 H34 M10 38 V44 M30 38 V44"]},
  {"id": "pushup", "head": [9, 28], "lines": ["13,31 30,35", "30,35 44,40", "13,31 13,37 13,44"]},
  {"id": "dip", "head": [24, 9], "lines": ["24,14 24,28", "24,28 29,34 26,40", "24,17 30,21 28,26"], "scene": ["M14 26 H36 M17 26 V44 M33 26 V44"]},
  {"id": "fly", "head": [24, 8], "lines": ["24,13 24,28", "24,28 21,36 20,44", "24,28 27,36 28,44", "24,16 16,19 11,19", "24,16 32,19 37,19"], "hold": [[10, 19], [38, 19]]},
  {"id": "press", "head": [24, 9], "lines": ["24,14 24,28", "24,28 22,36 21,44", "24,28 26,36 27,44", "24,16 18,12 19,4", "24,16 30,12 29,4"], "hold": [[19, 3], [29, 3]], "gear": "bar-over"},
  {"id": "landmine", "head": [22, 12], "lines": ["22,17 22,30", "22,30 30,31 30,44", "22,30 16,40 10,44", "22,20 27,15 32,9"], "hold": [[33, 8]], "scene": ["M33 8 L46 44"]},
  {"id": "latraise", "head": [24, 8], "lines": ["24,13 24,28", "24,28 21,36 20,44", "24,28 27,36 28,44", "24,16 16,17 9,17", "24,16 32,17 39,17"], "hold": [[8, 17], [40, 17]]},
  {"id": "row", "head": [11, 18], "lines": ["15,21 31,25", "31,25 28,34 29,44", "15,21 21,28 19,32"], "hold": [[19, 33]]},
  {"id": "dbrow", "head": [11, 19], "lines": ["15,22 30,22", "30,22 30,33 31,44", "15,22 13,30 13,32", "20,22 25,28 22,32"], "hold": [[22, 33]], "scene": ["M4 32 h18 v4 h-18 Z", "M6 36 V44 M20 36 V44"]},
  {"id": "cablerow", "head": [30, 13], "lines": ["30,18 33,32", "33,32 21,32 10,40", "30,21 24,27 22,22"], "hold": [[21, 22]], "anchor": [5, 24], "scene": ["M28 34 H40 M30 34 V44 M38 34 V44 M6 36 V44"]},
  {"id": "invrow", "head": [9, 26], "lines": ["13,27 30,33", "30,33 44,41", "13,27 18,22 19,16"], "scene": ["M10 16 H30"]},
  {"id": "pullup", "head": [24, 13], "lines": ["24,18 24,32", "24,32 22,38 25,44", "24,20 17,15 17,5", "24,20 31,15 31,5"], "scene": ["M8 4 H40"]},
  {"id": "pulldown", "head": [24, 16], "lines": ["24,21 24,33", "24,33 34,33 34,44", "24,23 17,19 15,10", "24,23 31,19 33,10"], "hold": [[15, 9], [33, 9]], "scene": ["M10 9 H38 M24 9 V2 M18 35 H30 M22 35 V44"]},
  {"id": "facepull", "head": [22, 9], "lines": ["22,14 22,28", "22,28 20,36 19,44", "22,28 25,36 26,44", "22,17 30,19 26,10"], "hold": [[27, 10]], "anchor": [46, 10]},
  {"id": "pullapart", "head": [24, 8], "lines": ["24,13 24,28", "24,28 21,36 20,44", "24,28 27,36 28,44", "24,16 15,20 8,19", "24,16 33,20 40,19"], "hold": [[8, 19], [40, 19]], "gear": "band-between"},
  {"id": "curl", "head": [24, 7], "lines": ["24,12 24,27", "24,27 22,35 21,44", "24,27 26,35 27,44", "24,15 21,22 26,17", "24,15 27,22 31,18"], "hold": [[27, 16], [32, 17]]},
  {"id": "pushdown", "head": [21, 7], "lines": ["21,12 21,27", "21,27 19,35 18,44", "21,27 23,35 24,44", "21,15 25,22 30,28"], "hold": [[31, 29]], "anchor": [32, 2]},
  {"id": "ohext", "head": [24, 10], "lines": ["24,15 24,28", "24,28 22,36 21,44", "24,28 26,36 27,44", "24,17 28,8 22,10"], "hold": [[21, 10]]},
  {"id": "calf", "head": [24, 5], "lines": ["24,10 24,25", "24,25 23,33 24,40 26,44", "24,25 26,33 27,40 29,44", "24,13 21,19 20,26", "24,13 27,19 28,26"], "hold": [[20, 27], [28, 27]], "scene": ["M20 44 H34"]},
  {"id": "tib", "head": [30, 7], "lines": ["30,12 28,26", "28,26 24,34 22,42 28,39", "28,26 26,34 24,42", "30,15 35,10 40,8"], "scene": ["M42 2 V44"]},
  {"id": "farmer", "head": [24, 7], "lines": ["24,12 24,27", "24,27 20,35 18,44", "24,27 28,35 31,44", "24,15 19,21 19,29", "24,15 29,21 29,29"], "hold": [[19, 31], [29, 31]]},
  {"id": "suitcase", "head": [24, 7], "lines": ["24,12 24,27", "24,27 20,35 18,44", "24,27 28,35 31,44", "24,15 21,21 21,26", "24,15 29,21 29,29"], "hold": [[29, 31]]},
  {"id": "plank", "head": [9, 30], "lines": ["13,33 30,36", "30,36 44,41", "13,33 13,40 20,40"]},
  {"id": "sideplank", "head": [11, 18], "lines": ["14,22 30,33", "30,33 44,42", "14,22 13,30 13,38", "14,22 17,14 18,8"]},
  {"id": "copen", "head": [10, 22], "lines": ["13,26 27,30", "27,30 40,32", "27,30 31,36 30,44", "13,26 12,33 12,40"], "scene": ["M34 33 h12 v4 h-12 Z", "M36 37 V44 M44 37 V44"]},
  {"id": "deadbug", "head": [8, 38], "lines": ["12,39 28,39", "28,39 30,30 38,30", "28,39 38,34 45,36", "13,39 14,28 15,20", "13,39 7,30 3,24"]},
  {"id": "pallof", "head": [22, 8], "lines": ["22,13 22,28", "22,28 18,36 17,44", "22,28 26,36 28,44", "22,16 28,19 34,18"], "hold": [[35, 18]], "anchor": [46, 18]},
  {"id": "hlr", "head": [24, 11], "lines": ["24,16 24,30", "24,30 36,30", "24,30 36,32", "24,18 20,12 19,4", "24,18 28,12 29,4"], "scene": ["M8 3 H40"]},
  {"id": "abwheel", "head": [12, 29], "lines": ["15,31 30,32", "30,32 38,38 44,44", "15,31 10,37 8,41"], "scene": ["M4 41 a3 3 0 1 0 6 0 a3 3 0 1 0 -6 0"]},
  {"id": "chop", "head": [22, 9], "lines": ["22,14 23,28", "23,28 18,36 16,44", "23,28 28,36 30,44", "22,17 30,23 35,30"], "hold": [[36, 31]], "anchor": [4, 3]},
  {"id": "boxjump", "head": [16, 6], "lines": ["17,11 21,24", "21,24 13,28 16,34", "21,24 14,30 18,35", "17,14 25,10 29,6"], "scene": ["M28 30 h16 v14 h-16 Z"]},
  {"id": "broad", "head": [27, 9], "lines": ["25,14 18,25", "18,25 14,32 8,33", "18,25 18,32 12,35", "25,16 33,14 38,10", "25,16 31,19 37,17"], "dashed": ["M4 40 C 14 22, 30 18, 44 40"]},
  {"id": "bound", "head": [17, 10], "lines": ["19,15 27,27", "27,27 18,30 16,38", "27,27 35,32 40,30", "19,17 12,23 9,28", "19,17 26,17 31,14"]},
  {"id": "jump", "head": [24, 5], "lines": ["24,10 24,24", "24,24 19,30 21,37", "24,24 29,30 27,37", "24,13 18,8 15,3", "24,13 30,8 33,3"], "scene": ["M14 42 H34 M24 39 V42"]},
  {"id": "swing", "head": [21, 8], "lines": ["21,13 23,27", "23,27 21,36 20,44", "23,27 27,36 28,44", "21,16 29,18 36,18"], "hold": [[37, 16]]},
  {"id": "throw", "head": [22, 8], "lines": ["22,13 22,28", "22,28 17,36 15,44", "22,28 28,36 31,44", "22,16 30,17 34,13", "22,16 28,20 34,15"], "hold": [[37, 13]]},
  {"id": "slam", "head": [24, 15], "lines": ["24,20 24,32", "24,32 20,38 18,44", "24,32 28,38 30,44", "24,22 20,15 22,9", "24,22 28,15 26,9"], "hold": [[24, 5]]},
  {"id": "rower", "head": [24, 20], "lines": ["24,25 26,37", "26,37 34,30 40,38", "24,27 31,30 36,31"], "scene": ["M4 42 H44 M38 38 V42 M40 33 L44 36", "M22 37 h8 v3 h-8 Z"]},
  {"id": "bike", "head": [18, 10], "lines": ["20,15 24,26", "24,26 30,31 28,38", "24,26 32,28 32,34", "20,17 28,21 34,20"], "scene": ["M5 38 a6 6 0 1 0 12 0 a6 6 0 1 0 -12 0", "M31 38 a6 6 0 1 0 12 0 a6 6 0 1 0 -12 0", "M11 38 L24 28 L36 21 M24 28 L37 38"]},
  {"id": "sled", "head": [16, 15], "lines": ["19,19 31,26", "31,26 26,34 22,44", "31,26 36,35 42,40", "19,20 14,22 10,20"], "scene": ["M2 14 V42 H12 M4 14 L8 14"]},
  {"id": "rope", "head": [24, 7], "lines": ["24,12 24,27", "24,27 22,35 23,41", "24,27 26,35 25,41", "24,15 18,22 15,26", "24,15 30,22 33,26"], "scene": ["M15 26 C 6 46, 42 50, 33 26"]},
  {"id": "burpee", "head": [11, 24], "lines": ["14,27 28,31", "28,31 32,38 30,44", "14,27 14,35 14,44"], "scene": ["M38 26 V8 M34 12 L38 7 L42 12"]},
  {"id": "hip9090", "head": [18, 14], "lines": ["19,19 22,32", "22,32 32,34 32,40", "22,32 14,36 6,40", "19,22 22,28 24,30"]},
  {"id": "stretch", "head": [22, 9], "lines": ["22,14 24,28", "24,28 33,32 34,44", "24,28 16,36 8,40", "22,17 18,10 16,3", "22,17 28,22 32,30"]},